{
  "slug": "seasons-skateshop",
  "name": "Seasons Skate Shop",
  "tagline": "Queens' own skate shop",
  "borough": "Queens",
  "neighborhood": "Woodhaven",
  "address": "86-56 Jamaica Ave, Woodhaven, NY 11421",
  "coordinates": { "lat": 40.6904, "lng": -73.8567 },
  "phone": "+17188054753",
  "website": "https://seasonsskateshop.com",
  "instagram": "@seasonsskateshop",
  "hours": {
    "monday": "12:00-19:00",
    "tuesday": "12:00-19:00",
    "wednesday": "12:00-19:00",
    "thursday": "12:00-19:00",
    "friday": "12:00-20:00",
    "saturday": "11:00-20:00",
    "sunday": "11:00-18:00"
  },
  "specialties": ["decks", "apparel", "streetwear", "shoes"],
  "vibes": ["neighborhood staple", "streetwear-forward", "Queens pride"],
  "team_riders": [],
  "story": "A Queens neighborhood staple keeping the local skate scene stocked with fresh decks, streetwear brands like Cash Only, and all the essentials.",
  "photos": [],
  "pos_system": "shopify",
  "pos_api_enabled": true,
  "subscription_tier": "basic",
  "joined_date": "2026-02-01"
}
