{
  "slug": "uptown-riders",
  "name": "Uptown Riders",
  "tagline": "Harlem's skate headquarters",
  "borough": "Manhattan",
  "neighborhood": "Harlem",
  "address": "2144 Frederick Douglass Blvd, New York, NY 10026",
  "coordinates": { "lat": 40.8028, "lng": -73.9558 },
  "phone": "+12125551234",
  "website": "",
  "instagram": "@uptownridersnyc",
  "hours": {
    "monday": "12:00-19:00",
    "tuesday": "12:00-19:00",
    "wednesday": "12:00-19:00",
    "thursday": "12:00-19:00",
    "friday": "12:00-20:00",
    "saturday": "11:00-20:00",
    "sunday": "12:00-18:00"
  },
  "specialties": ["decks", "wheels", "trucks", "community events"],
  "vibes": ["uptown culture", "community hub", "welcoming"],
  "team_riders": [],
  "story": "Bringing skateboarding uptown. A community hub for Harlem skaters with events, workshops, and all the gear you need.",
  "photos": [],
  "pos_system": "square",
  "pos_api_enabled": false,
  "subscription_tier": "basic",
  "joined_date": "2026-02-01"
}
